chapix_dev,verseix_dev,stanza1_dev,stanza2_dev,speaker_dev,chapix_itrans,verseix_itrans,stanza1_itrans,stanza2_itrans,stanza1_slp1,stanza2_slp1
 ४,४,अपरं भवतो जन्म परं जन्म विवस्वतः,कथमेतद्विजानीयां त्वमादौ प्रोक्तवानिति,अर्जुन उवाच,4,4,aparaM bhavato janma paraM janma vivasvataH,kathametadvijAnIyAM tvamAdau proktavAniti,aparaM Bavato janma paraM janma vivasvataH,kaTametadvijAnIyAM tvamAdO proktavAniti
 ४,५,बहूनि मे व्यतीतानि जन्मानि तव चार्जुन,तान्यहं वेद सर्वाणि न त्वं वेत्थ परन्तप,श्रीभगवानुवाच,4,5,bahUni me vyatItAni janmAni tava chArjuna,tAnyahaM veda sarvANi na tvaM vettha parantapa,bahUni me vyatItAni janmAni tava cArjuna,tAnyahaM veda sarvARi na tvaM vetTa parantapa
 ४,६,अजोऽपि सन्नव्ययात्मा भूतानामीश्वरोऽपि सन्,प्रकृतिं स्वामधिष्ठाय सम्भवाम्यात्ममायया,श्रीभगवानुवाच,4,6,ajo.api sannavyayAtmA bhUtAnAmIshvaro.api san,prakRRitiM svAmadhiShThAya sambhavAmyAtmamAyayA,ajo'pi sannavyayAtmA BUtAnAmISvaro'pi san,prakftiM svAmaDizWAya samBavAmyAtmamAyayA
 ४,७,यदा यदा हि धर्मस्य ग्लानिर्भवति भारत,अभ्युत्थानमधर्मस्य तदात्मानं सृजाम्यहम्,श्रीभगवानुवाच,4,7,yadA yadA hi dharmasya glAnirbhavati bhArata,abhyutthAnamadharmasya tadAtmAnaM sRRijAmyaham,yadA yadA hi Darmasya glAnirBavati BArata,aByutTAnamaDarmasya tadAtmAnaM sfjAmyaham
 ४,८,परित्राणाय साधूनां विनाशाय च दुष्कृताम्,धर्मसंस्थापनार्थाय सम्भवामि युगे युगे,श्रीभगवानुवाच,4,8,paritrANAya sAdhUnAM vinAshAya cha duShkRRitAm,dharmasaMsthApanArthAya sambhavAmi yuge yuge,paritrARAya sADUnAM vinASAya ca duzkftAm,DarmasaMsTApanArTAya samBavAmi yuge yuge
 ४,९,जन्म कर्म च मे दिव्यमेवं यो वेत्ति तत्त्वतः,त्यक्त्वा देहं पुनर्जन्म नैति मामेति सोऽर्जुन,श्रीभगवानुवाच,4,9,janma karma cha me divyamevaM yo vetti tattvataH,tyaktvA dehaM punarjanma naiti mAmeti so.arjuna,janma karma ca me divyamevaM yo vetti tattvataH,tyaktvA dehaM punarjanma nEti mAmeti so'rjuna
 ४,१०,वीतरागभयक्रोधा मन्मया मामुपाश्रिताः,बहवो ज्ञानतपसा पूता मद्भावमागताः,श्रीभगवानुवाच,4,10,vItarAgabhayakrodhA manmayA mAmupAshritAH,bahavo j~nAnatapasA pUtA madbhAvamAgatAH,vItarAgaBayakroDA manmayA mAmupASritAH,bahavo jYAnatapasA pUtA madBAvamAgatAH
 ४,११,ये यथा मां प्रपद्यन्ते तांस्तथैव भजाम्यहम्,मम वर्त्मानुवर्तन्ते मनुष्याः पार्थ सर्वशः,श्रीभगवानुवाच,4,11,ye yathA mAM prapadyante tAMstathaiva bhajAmyaham,mama vartmAnuvartante manuShyAH pArtha sarvashaH,ye yaTA mAM prapadyante tAMstaTEva BajAmyaham,mama vartmAnuvartante manuzyAH pArTa sarvaSaH
 ४,१२,काङ्क्षन्तः कर्मणां सिद्धिं यजन्त इह देवताः,क्षिप्रं हि मानुषे लोके सिद्धिर्भवति कर्मजा,श्रीभगवानुवाच,4,12,kA~NkShantaH karmaNAM siddhiM yajanta iha devatAH,kShipraM hi mAnuShe loke siddhirbhavati karmajA,kANkzantaH karmaRAM sidDiM yajanta iha devatAH,kzipraM hi mAnuze loke sidDirBavati karmajA
 ४,१३,चातुर्वर्ण्यं मया सृष्टं गुणकर्मविभागशः,तस्य कर्तारमपि मां विद्ध्यकर्तारमव्ययम्,श्रीभगवानुवाच,4,13,chAturvarNyaM mayA sRRiShTaM guNakarmavibhAgashaH,tasya kartAramapi mAM viddhyakartAramavyayam,cAturvarRyaM mayA sfzwaM guRakarmaviBAgaSaH,tasya kartAramapi mAM vidDyakartAramavyayam
 ४,१४,न मां कर्माणि लिम्पन्ति न मे कर्मफले स्पृहा,इति मां योऽभिजानाति कर्मभिर्न स बध्यते,श्रीभगवानुवाच,4,14,na mAM karmANi limpanti na me karmaphale spRRihA,iti mAM yo.abhijAnAti karmabhirna sa badhyate,na mAM karmARi limpanti na me karmaPale spfhA,iti mAM yo'BijAnAti karmaBirna sa baDyate
 ४,१५,एवं ज्ञात्वा कृतं कर्म पूर्वैरपि मुमुक्षुभिः,कुरु कर्मैव तस्मात्त्वं पूर्वैः पूर्वतरं कृतम्,श्रीभगवानुवाच,4,15,evaM j~nAtvA kRRitaM karma pUrvairapi mumukShubhiH,kuru karmaiva tasmAttvaM pUrvaiH pUrvataraM kRRitam,evaM jYAtvA kftaM karma pUrvErapi mumukzuBiH,kuru karmEva tasmAttvaM pUrvEH pUrvataraM kftam
 ४,१६,किं कर्म किमकर्मेति कवयोऽप्यत्र मोहिताः,तत्ते कर्म प्रवक्ष्यामि यज्ज्ञात्वा मोक्ष्यसेऽशुभात्,श्रीभगवानुवाच,4,16,kiM karma kimakarmeti kavayo.apyatra mohitAH,tatte karma pravakShyAmi yajj~nAtvA mokShyase.ashubhAt,kiM karma kimakarmeti kavayo'pyatra mohitAH,tatte karma pravakzyAmi yajjYAtvA mokzyase'SuBAt
 ४,१७,कर्मणो ह्यपि बोद्धव्यं बोद्धव्यं च विकर्मणः,अकर्मणश्च बोद्धव्यं गहना कर्मणो गतिः,श्रीभगवानुवाच,4,17,karmaNo hyapi boddhavyaM boddhavyaM cha vikarmaNaH,akarmaNashcha boddhavyaM gahanA karmaNo gatiH,karmaRo hyapi bodDavyaM bodDavyaM ca vikarmaRaH,akarmaRaSca bodDavyaM gahanA karmaRo gatiH
 ४,१८,कर्मण्यकर्म यः पश्येदकर्मणि च कर्म यः,स बुद्धिमान्मनुष्येषु स युक्तः कृत्स्नकर्मकृत्,श्रीभगवानुवाच,4,18,karmaNyakarma yaH pashyedakarmaNi cha karma yaH,sa buddhimAnmanuShyeShu sa yuktaH kRRitsnakarmakRRit,karmaRyakarma yaH paSyedakarmaRi ca karma yaH,sa budDimAnmanuzyezu sa yuktaH kftsnakarmakft
 ४,१९,यस्य सर्वे समारम्भाः कामसङ्कल्पवर्जिताः,ज्ञानाग्निदग्धकर्माणं तमाहुः पण्डितं बुधाः,श्रीभगवानुवाच,4,19,yasya sarve samArambhAH kAmasa~NkalpavarjitAH,j~nAnAgnidagdhakarmANaM tamAhuH paNDitaM budhAH,yasya sarve samAramBAH kAmasaNkalpavarjitAH,jYAnAgnidagDakarmARaM tamAhuH paRqitaM buDAH
 ४,२०,त्यक्त्वा कर्मफलासङ्गं नित्यतृप्तो निराश्रयः,कर्मण्यभिप्रवृत्तोऽपि नैव किञ्चित्करोति सः,श्रीभगवानुवाच,4,20,tyaktvA karmaphalAsa~NgaM nityatRRipto nirAshrayaH,karmaNyabhipravRRitto.api naiva ki~nchitkaroti saH,tyaktvA karmaPalAsaNgaM nityatfpto nirASrayaH,karmaRyaBipravftto'pi nEva kiYcitkaroti saH
 ४,२१,निराशीर्यतचित्तात्मा त्यक्तसर्वपरिग्रहः,शारीरं केवलं कर्म कुर्वन्नाप्नोति किल्बिषम्,श्रीभगवानुवाच,4,21,nirAshIryatachittAtmA tyaktasarvaparigrahaH,shArIraM kevalaM karma kurvannApnoti kilbiSham,nirASIryatacittAtmA tyaktasarvaparigrahaH,SArIraM kevalaM karma kurvannApnoti kilbizam
 ४,२२,यदृच्छालाभसन्तुष्टो द्वन्द्वातीतो विमत्सरः,समः सिद्धावसिद्धौ च कृत्वापि न निबध्यते,श्रीभगवानुवाच,4,22,yadRRichChAlAbhasantuShTo dvandvAtIto vimatsaraH,samaH siddhAvasiddhau cha kRRitvApi na nibadhyate,yadfcCAlABasantuzwo dvandvAtIto vimatsaraH,samaH sidDAvasidDO ca kftvApi na nibaDyate
 ४,२३,गतसङ्गस्य मुक्तस्य ज्ञानावस्थितचेतसः,यज्ञायाचरतः कर्म समग्रं प्रविलीयते,श्रीभगवानुवाच,4,23,gatasa~Ngasya muktasya j~nAnAvasthitachetasaH,yaj~nAyAcharataH karma samagraM pravilIyate,gatasaNgasya muktasya jYAnAvasTitacetasaH,yajYAyAcarataH karma samagraM pravilIyate
 ४,२४,ब्रह्मार्पणं ब्रह्म हविर्ब्रह्माग्नौ ब्रह्मणा हुतम्,ब्रह्मैव तेन गन्तव्यं ब्रह्मकर्मसमाधिना,श्रीभगवानुवाच,4,24,brahmArpaNaM brahma havirbrahmAgnau brahmaNA hutam,brahmaiva tena gantavyaM brahmakarmasamAdhinA,brahmArpaRaM brahma havirbrahmAgnO brahmaRA hutam,brahmEva tena gantavyaM brahmakarmasamADinA
 ४,२५,दैवमेवापरे यज्ञं योगिनः पर्युपासते,ब्रह्माग्नावपरे यज्ञं यज्ञेनैवोपजुह्वति,श्रीभगवानुवाच,4,25,daivamevApare yaj~naM yoginaH paryupAsate,brahmAgnAvapare yaj~naM yaj~nenaivopajuhvati,dEvamevApare yajYaM yoginaH paryupAsate,brahmAgnAvapare yajYaM yajYenEvopajuhvati
 ४,२६,श्रोत्रादीनीन्द्रियाण्यन्ये संयमाग्निषु जुह्वति,शब्दादीन्विषयानन्य इन्द्रियाग्निषु जुह्वति,श्रीभगवानुवाच,4,26,shrotrAdInIndriyANyanye saMyamAgniShu juhvati,shabdAdInviShayAnanya indriyAgniShu juhvati,SrotrAdInIndriyARyanye saMyamAgnizu juhvati,SabdAdInvizayAnanya indriyAgnizu juhvati
 ४,२७,सर्वाणीन्द्रियकर्माणि प्राणकर्माणि चापरे,आत्मसंयमयोगाग्नौ जुह्वति ज्ञानदीपिते,श्रीभगवानुवाच,4,27,sarvANIndriyakarmANi prANakarmANi chApare,AtmasaMyamayogAgnau juhvati j~nAnadIpite,sarvARIndriyakarmARi prARakarmARi cApare,AtmasaMyamayogAgnO juhvati jYAnadIpite
 ४,२८,द्रव्ययज्ञास्तपोयज्ञा योगयज्ञास्तथापरे,स्वाध्यायज्ञानयज्ञाश्च यतयः संशितव्रताः,श्रीभगवानुवाच,4,28,dravyayaj~nAstapoyaj~nA yogayaj~nAstathApare,svAdhyAyaj~nAnayaj~nAshcha yatayaH saMshitavratAH,dravyayajYAstapoyajYA yogayajYAstaTApare,svADyAyajYAnayajYASca yatayaH saMSitavratAH
 ४,२९,अपाने जुह्वति प्राणं प्राणेऽपानं तथापरे,प्राणापानगती रुद्ध्वा प्राणायामपरायणाः,श्रीभगवानुवाच,4,29,apAne juhvati prANaM prANe.apAnaM tathApare,prANApAnagatI ruddhvA prANAyAmaparAyaNAH,apAne juhvati prARaM prARe'pAnaM taTApare,prARApAnagatI rudDvA prARAyAmaparAyaRAH
 ४,३०,अपरे नियताहाराः प्राणान्प्राणेषु जुह्वति,सर्वेऽप्येते यज्ञविदो यज्ञक्षपितकल्मषाः,श्रीभगवानुवाच,4,30,apare niyatAhArAH prANAnprANeShu juhvati,sarve.apyete yaj~navido yaj~nakShapitakalmaShAH,apare niyatAhArAH prARAnprARezu juhvati,sarve'pyete yajYavido yajYakzapitakalmazAH
 ४,३१,यज्ञशिष्टामृतभुजो यान्ति ब्रह्म सनातनम्,नायं लोकोऽस्त्ययज्ञस्य कुतोऽन्यः कुरुसत्तम,श्रीभगवानुवाच,4,31,yaj~nashiShTAmRRitabhujo yAnti brahma sanAtanam,nAyaM loko.astyayaj~nasya kuto.anyaH kurusattama,yajYaSizwAmftaBujo yAnti brahma sanAtanam,nAyaM loko'styayajYasya kuto'nyaH kurusattama
 ४,३२,एवं बहुविधा यज्ञा वितता ब्रह्मणो मुखे,कर्मजान्विद्धि तान्सर्वानेवं ज्ञात्वा विमोक्ष्यसे,श्रीभगवानुवाच,4,32,evaM bahuvidhA yaj~nA vitatA brahmaNo mukhe,karmajAnviddhi tAnsarvAnevaM j~nAtvA vimokShyase,evaM bahuviDA yajYA vitatA brahmaRo muKe,karmajAnvidDi tAnsarvAnevaM jYAtvA vimokzyase
 ४,३३,श्रेयान्द्रव्यमयाद्यज्ञाज्ज्ञानयज्ञः परन्तप,सर्वं कर्माखिलं पार्थ ज्ञाने परिसमाप्यते,श्रीभगवानुवाच,4,33,shreyAndravyamayAdyaj~nAjj~nAnayaj~naH parantapa,sarvaM karmAkhilaM pArtha j~nAne parisamApyate,SreyAndravyamayAdyajYAjjYAnayajYaH parantapa,sarvaM karmAKilaM pArTa jYAne parisamApyate
 ४,३४,तद्विद्धि प्रणिपातेन परिप्रश्नेन सेवया,उपदेक्ष्यन्ति ते ज्ञानं ज्ञानिनस्तत्त्वदर्शिनः,श्रीभगवानुवाच,4,34,tadviddhi praNipAtena pariprashnena sevayA,upadekShyanti te j~nAnaM j~nAninastattvadarshinaH,tadvidDi praRipAtena paripraSnena sevayA,upadekzyanti te jYAnaM jYAninastattvadarSinaH
 ४,३५,यज्ज्ञात्वा न पुनर्मोहमेवं यास्यसि पाण्डव,येन भूतान्यशेषेण द्रक्ष्यस्यात्मन्यथो मयि,श्रीभगवानुवाच,4,35,yajj~nAtvA na punarmohamevaM yAsyasi pANDava,yena bhUtAnyasheSheNa drakShyasyAtmanyatho mayi,yajjYAtvA na punarmohamevaM yAsyasi pARqava,yena BUtAnyaSezeRa drakzyasyAtmanyaTo mayi
 ४,३६,अपि चेदसि पापेभ्यः सर्वेभ्यः पापकृत्तमः,सर्वं ज्ञानप्लवेनैव वृजिनं सन्तरिष्यसि,श्रीभगवानुवाच,4,36,api chedasi pApebhyaH sarvebhyaH pApakRRittamaH,sarvaM j~nAnaplavenaiva vRRijinaM santariShyasi,api cedasi pApeByaH sarveByaH pApakfttamaH,sarvaM jYAnaplavenEva vfjinaM santarizyasi
 ४,३७,यथैधांसि समिद्धोऽग्निर्भस्मसात्कुरुतेऽर्जुन,ज्ञानाग्निः सर्वकर्माणि भस्मसात्कुरुते तथा,श्रीभगवानुवाच,4,37,yathaidhAMsi samiddho.agnirbhasmasAtkurute.arjuna,j~nAnAgniH sarvakarmANi bhasmasAtkurute tathA,yaTEDAMsi samidDo'gnirBasmasAtkurute'rjuna,jYAnAgniH sarvakarmARi BasmasAtkurute taTA
 ४,३८,न हि ज्ञानेन सदृशं पवित्रमिह विद्यते,तत्स्वयं योगसंसिद्धः कालेनात्मनि विन्दति,श्रीभगवानुवाच,4,38,na hi j~nAnena sadRRishaM pavitramiha vidyate,tatsvayaM yogasaMsiddhaH kAlenAtmani vindati,na hi jYAnena sadfSaM pavitramiha vidyate,tatsvayaM yogasaMsidDaH kAlenAtmani vindati
 ४,३९,श्रद्धावाँल्लभते ज्ञानं तत्परः संयतेन्द्रियः,ज्ञानं लब्ध्वा परां शान्तिमचिरेणाधिगच्छति,श्रीभगवानुवाच,4,39,shraddhAvA.Nllabhate j~nAnaM tatparaH saMyatendriyaH,j~nAnaM labdhvA parAM shAntimachireNAdhigachChati,SradDAvA~llaBate jYAnaM tatparaH saMyatendriyaH,jYAnaM labDvA parAM SAntimacireRADigacCati
 ४,४०,अज्ञश्चाश्रद्दधानश्च संशयात्मा विनश्यति,नायं लोकोऽस्ति न परो न सुखं संशयात्मनः,श्रीभगवानुवाच,4,40,aj~nashchAshraddadhAnashcha saMshayAtmA vinashyati,nAyaM loko.asti na paro na sukhaM saMshayAtmanaH,ajYaScASraddaDAnaSca saMSayAtmA vinaSyati,nAyaM loko'sti na paro na suKaM saMSayAtmanaH
 ४,४१,योगसंन्यस्तकर्माणं ज्ञानसञ्छिन्नसंशयम्,आत्मवन्तं न कर्माणि निबध्नन्ति धनञ्जय,श्रीभगवानुवाच,4,41,yogasaMnyastakarmANaM j~nAnasa~nChinnasaMshayam,AtmavantaM na karmANi nibadhnanti dhana~njaya,yogasaMnyastakarmARaM jYAnasaYCinnasaMSayam,AtmavantaM na karmARi nibaDnanti DanaYjaya
 ४,४२,तस्मादज्ञानसम्भूतं हृत्स्थं ज्ञानासिनात्मनः,छित्त्वैनं संशयं योगमातिष्ठोत्तिष्ठ भारत,श्रीभगवानुवाच,4,42,tasmAdaj~nAnasambhUtaM hRRitsthaM j~nAnAsinAtmanaH,ChittvainaM saMshayaM yogamAtiShThottiShTha bhArata,tasmAdajYAnasamBUtaM hftsTaM jYAnAsinAtmanaH,CittvEnaM saMSayaM yogamAtizWottizWa BArata
 ५,१,संन्यासं कर्मणां कृष्ण पुनर्योगं च शंससि,यच्छ्रेय एतयोरेकं तन्मे ब्रूहि सुनिश्चितम्,अर्जुन उवाच,5,1,saMnyAsaM karmaNAM kRRiShNa punaryogaM cha shaMsasi,yachChreya etayorekaM tanme brUhi sunishchitam,saMnyAsaM karmaRAM kfzRa punaryogaM ca SaMsasi,yacCreya etayorekaM tanme brUhi suniScitam
 ५,२,संन्यासः कर्मयोगश्च निःश्रेयसकरावुभौ,तयोस्तु कर्मसंन्यासात्कर्मयोगो विशिष्यते,श्रीभगवानुवाच,5,2,saMnyAsaH karmayogashcha niHshreyasakarAvubhau,tayostu karmasaMnyAsAtkarmayogo vishiShyate,saMnyAsaH karmayogaSca niHSreyasakarAvuBO,tayostu karmasaMnyAsAtkarmayogo viSizyate
 ५,३,ज्ञेयः स नित्यसंन्यासी यो न द्वेष्टि न काङ्क्षति,निर्द्वन्द्वो हि महाबाहो सुखं बन्धात्प्रमुच्यते,श्रीभगवानुवाच,5,3,j~neyaH sa nityasaMnyAsI yo na dveShTi na kA~NkShati,nirdvandvo hi mahAbAho sukhaM bandhAtpramuchyate,jYeyaH sa nityasaMnyAsI yo na dvezwi na kANkzati,nirdvandvo hi mahAbAho suKaM banDAtpramucyate
 ५,४,साङ्ख्ययोगौ पृथग्बालाः प्रवदन्ति न पण्डिताः,एकमप्यास्थितः सम्यगुभयोर्विन्दते फलम्,श्रीभगवानुवाच,5,4,sA~Nkhyayogau pRRithagbAlAH pravadanti na paNDitAH,ekamapyAsthitaH samyagubhayorvindate phalam,sANKyayogO pfTagbAlAH pravadanti na paRqitAH,ekamapyAsTitaH samyaguBayorvindate Palam
 ५,५,यत्साङ्ख्यैः प्राप्यते स्थानं तद्योगैरपि गम्यते,एकं साङ्ख्यं च योगं च यः पश्यति स पश्यति,श्रीभगवानुवाच,5,5,yatsA~NkhyaiH prApyate sthAnaM tadyogairapi gamyate,ekaM sA~NkhyaM cha yogaM cha yaH pashyati sa pashyati,yatsANKyEH prApyate sTAnaM tadyogErapi gamyate,ekaM sANKyaM ca yogaM ca yaH paSyati sa paSyati
 ५,६,संन्यासस्तु महाबाहो दुःखमाप्तुमयोगतः,योगयुक्तो मुनिर्ब्रह्म नचिरेणाधिगच्छति,श्रीभगवानुवाच,5,6,saMnyAsastu mahAbAho duHkhamAptumayogataH,yogayukto munirbrahma nachireNAdhigachChati,saMnyAsastu mahAbAho duHKamAptumayogataH,yogayukto munirbrahma nacireRADigacCati
 ५,७,योगयुक्तो विशुद्धात्मा विजितात्मा जितेन्द्रियः,सर्वभूतात्मभूतात्मा कुर्वन्नपि न लिप्यते,श्रीभगवानुवाच,5,7,yogayukto vishuddhAtmA vijitAtmA jitendriyaH,sarvabhUtAtmabhUtAtmA kurvannapi na lipyate,yogayukto viSudDAtmA vijitAtmA jitendriyaH,sarvaBUtAtmaBUtAtmA kurvannapi na lipyate
 ५,८,नैव किञ्चित्करोमीति युक्तो मन्येत तत्त्ववित्,पश्यञ्शृण्वन्स्पृशञ्जिघ्रन्नश्नन्गच्छन्स्वपञ्श्वसन्,श्रीभगवानुवाच,5,8,naiva ki~nchitkaromIti yukto manyeta tattvavit,pashya~nshRRiNvanspRRisha~njighrannashnangachChansvapa~nshvasan,nEva kiYcitkaromIti yukto manyeta tattvavit,paSyaYSfRvanspfSaYjiGrannaSnangacCansvapaYSvasan
 ५,९,प्रलपन्विसृजन्गृह्णन्नुन्मिषन्निमिषन्नपि,इन्द्रियाणीन्द्रियार्थेषु वर्तन्त इति धारयन्,श्रीभगवानुवाच,5,9,pralapanvisRRijangRRihNannunmiShannimiShannapi,indriyANIndriyArtheShu vartanta iti dhArayan,pralapanvisfjangfhRannunmizannimizannapi,indriyARIndriyArTezu vartanta iti DArayan
 ५,१०,ब्रह्मण्याधाय कर्माणि सङ्गं त्यक्त्वा करोति यः,लिप्यते न स पापेन पद्मपत्रमिवाम्भसा,श्रीभगवानुवाच,5,10,brahmaNyAdhAya karmANi sa~NgaM tyaktvA karoti yaH,lipyate na sa pApena padmapatramivAmbhasA,brahmaRyADAya karmARi saNgaM tyaktvA karoti yaH,lipyate na sa pApena padmapatramivAmBasA
 ५,११,कायेन मनसा बुद्ध्या केवलैरिन्द्रियैरपि,योगिनः कर्म कुर्वन्ति सङ्गं त्यक्त्वात्मशुद्धये,श्रीभगवानुवाच,5,11,kAyena manasA buddhyA kevalairindriyairapi,yoginaH karma kurvanti sa~NgaM tyaktvAtmashuddhaye,kAyena manasA budDyA kevalErindriyErapi,yoginaH karma kurvanti saNgaM tyaktvAtmaSudDaye
 ५,१२,युक्तः कर्मफलं त्यक्त्वा शान्तिमाप्नोति नैष्ठिकीम्,अयुक्तः कामकारेण फले सक्तो निबध्यते,श्रीभगवानुवाच,5,12,yuktaH karmaphalaM tyaktvA shAntimApnoti naiShThikIm,ayuktaH kAmakAreNa phale sakto nibadhyate,yuktaH karmaPalaM tyaktvA SAntimApnoti nEzWikIm,ayuktaH kAmakAreRa Pale sakto nibaDyate
 ५,१३,सर्वकर्माणि मनसा संन्यस्यास्ते सुखं वशी,नवद्वारे पुरे देही नैव कुर्वन्न कारयन्,श्रीभगवानुवाच,5,13,sarvakarmANi manasA saMnyasyAste sukhaM vashI,navadvAre pure dehI naiva kurvanna kArayan,sarvakarmARi manasA saMnyasyAste suKaM vaSI,navadvAre pure dehI nEva kurvanna kArayan
 ५,१४,न कर्तृत्वं न कर्माणि लोकस्य सृजति प्रभुः,न कर्मफलसंयोगं स्वभावस्तु प्रवर्तते,श्रीभगवानुवाच,5,14,na kartRRitvaM na karmANi lokasya sRRijati prabhuH,na karmaphalasaMyogaM svabhAvastu pravartate,na kartftvaM na karmARi lokasya sfjati praBuH,na karmaPalasaMyogaM svaBAvastu pravartate
 ५,१५,नादत्ते कस्यचित्पापं न चैव सुकृतं विभुः,अज्ञानेनावृतं ज्ञानं तेन मुह्यन्ति जन्तवः,श्रीभगवानुवाच,5,15,nAdatte kasyachitpApaM na chaiva sukRRitaM vibhuH,aj~nAnenAvRRitaM j~nAnaM tena muhyanti jantavaH,nAdatte kasyacitpApaM na cEva sukftaM viBuH,ajYAnenAvftaM jYAnaM tena muhyanti jantavaH
 ५,१६,ज्ञानेन तु तदज्ञानं येषां नाशितमात्मनः,तेषामादित्यवज्ज्ञानं प्रकाशयति तत्परम्,श्रीभगवानुवाच,5,16,j~nAnena tu tadaj~nAnaM yeShAM nAshitamAtmanaH,teShAmAdityavajj~nAnaM prakAshayati tatparam,jYAnena tu tadajYAnaM yezAM nASitamAtmanaH,tezAmAdityavajjYAnaM prakASayati tatparam
