chapix_dev,verseix_dev,stanza1_dev,stanza2_dev,speaker_dev,chapix_itrans,verseix_itrans,stanza1_itrans,stanza2_itrans,stanza1_slp1,stanza2_slp1
 १२,१८,समः शत्रौ च मित्रे च तथा मानापमानयोः,शीतोष्णसुखदुःखेषु समः सङ्गविवर्जितः,श्रीभगवानुवाच,12,18,samaH shatrau cha mitre cha tathA mAnApamAnayoH,shItoShNasukhaduHkheShu samaH sa~NgavivarjitaH,samaH SatrO ca mitre ca taTA mAnApamAnayoH,SItozRasuKaduHKezu samaH saNgavivarjitaH
 १२,१९,तुल्यनिन्दास्तुतिर्मौनी सन्तुष्टो येन केनचित्,अनिकेतः स्थिरमतिर्भक्तिमान्मे प्रियो नरः,श्रीभगवानुवाच,12,19,tulyanindAstutirmaunI santuShTo yena kenachit,aniketaH sthiramatirbhaktimAnme priyo naraH,tulyanindAstutirmOnI santuzwo yena kenacit,aniketaH sTiramatirBaktimAnme priyo naraH
 १२,२०,ये तु धर्म्यामृतमिदं यथोक्तं पर्युपासते,श्रद्दधाना मत्परमा भक्तास्तेऽतीव मे प्रियाः,श्रीभगवानुवाच,12,20,ye tu dharmyAmRRitamidaM yathoktaM paryupAsate,shraddadhAnA matparamA bhaktAste.atIva me priyAH,ye tu DarmyAmftamidaM yaToktaM paryupAsate,SraddaDAnA matparamA BaktAste'tIva me priyAH
 १३,१,प्रकृतिं पुरुषं चैव क्षेत्रं क्षेत्रज्ञमेव च,एतद्वेदितुमिच्छामि ज्ञानं ज्ञेयं च केशव,अर्जुन उवाच,13,1,prakRRitiM puruShaM chaiva kShetraM kShetraj~nameva cha,etadveditumichChAmi j~nAnaM j~neyaM cha keshava,prakftiM puruzaM cEva kzetraM kzetrajYameva ca,etadveditumicCAmi jYAnaM jYeyaM ca keSava
 १३,२,इदं शरीरं कौन्तेय क्षेत्रमित्यभिधीयते,एतद्यो वेत्ति तं प्राहुः क्षेत्रज्ञ इति तद्विदः,श्रीभगवानुवाच,13,2,idaM sharIraM kaunteya kShetramityabhidhIyate,etadyo vetti taM prAhuH kShetraj~na iti tadvidaH,idaM SarIraM kOnteya kzetramityaBiDIyate,etadyo vetti taM prAhuH kzetrajYa iti tadvidaH
 १३,३,क्षेत्रज्ञं चापि मां विद्धि सर्वक्षेत्रेषु भारत,क्षेत्रक्षेत्रज्ञयोर्ज्ञानं यत्तज्ज्ञानं मतं मम,श्रीभगवानुवाच,13,3,kShetraj~naM chApi mAM viddhi sarvakShetreShu bhArata,kShetrakShetraj~nayorj~nAnaM yattajj~nAnaM mataM mama,kzetrajYaM cApi mAM vidDi sarvakzetrezu BArata,kzetrakzetrajYayorjYAnaM yattajjYAnaM mataM mama
 १३,४,तत्क्षेत्रं यच्च यादृक्च यद्विकारि यतश्च यत्,स च यो यत्प्रभावश्च तत्समासेन मे शृणु,श्रीभगवानुवाच,13,4,tatkShetraM yachcha yAdRRikcha yadvikAri yatashcha yat,sa cha yo yatprabhAvashcha tatsamAsena me shRRiNu,tatkzetraM yacca yAdfkca yadvikAri yataSca yat,sa ca yo yatpraBAvaSca tatsamAsena me SfRu
 १३,५,ऋषिभिर्बहुधा गीतं छन्दोभिर्विविधैः पृथक्,ब्रह्मसूत्रपदैश्चैव हेतुमद्भिर्विनिश्चितैः,श्रीभगवानुवाच,13,5,RRiShibhirbahudhA gItaM ChandobhirvividhaiH pRRithak,brahmasUtrapadaishchaiva hetumadbhirvinishchitaiH,fziBirbahuDA gItaM CandoBirviviDEH pfTak,brahmasUtrapadEScEva hetumadBirviniScitEH
 १३,६,महाभूतान्यहङ्कारो बुद्धिरव्यक्तमेव च,इन्द्रियाणि दशैकं च पञ्च चेन्द्रियगोचराः,श्रीभगवानुवाच,13,6,mahAbhUtAnyaha~NkAro buddhiravyaktameva cha,indriyANi dashaikaM cha pa~ncha chendriyagocharAH,mahABUtAnyahaNkAro budDiravyaktameva ca,indriyARi daSEkaM ca paYca cendriyagocarAH
 १३,७,इच्छा द्वेषः सुखं दुःखं सङ्घातश्चेतना धृतिः,एतत्क्षेत्रं समासेन सविकारमुदाहृतम्,श्रीभगवानुवाच,13,7,ichChA dveShaH sukhaM duHkhaM sa~NghAtashchetanA dhRRitiH,etatkShetraM samAsena savikAramudAhRRitam,icCA dvezaH suKaM duHKaM saNGAtaScetanA DftiH,etatkzetraM samAsena savikAramudAhftam
 १३,८,अमानित्वमदम्भित्वमहिंसा क्षान्तिरार्जवम्,आचार्योपासनं शौचं स्थैर्यमात्मविनिग्रहः,श्रीभगवानुवाच,13,8,amAnitvamadambhitvamahiMsA kShAntirArjavam,AchAryopAsanaM shauchaM sthairyamAtmavinigrahaH,amAnitvamadamBitvamahiMsA kzAntirArjavam,AcAryopAsanaM SOcaM sTEryamAtmavinigrahaH
 १३,९,इन्द्रियार्थेषु वैराग्यमनहङ्कार एव च,जन्ममृत्युजराव्याधिदुःखदोषानुदर्शनम्,श्रीभगवानुवाच,13,9,indriyArtheShu vairAgyamanaha~NkAra eva cha,janmamRRityujarAvyAdhiduHkhadoShAnudarshanam,indriyArTezu vErAgyamanahaNkAra eva ca,janmamftyujarAvyADiduHKadozAnudarSanam
 १३,१०,असक्तिरनभिष्वङ्गः पुत्रदारगृहादिषु,नित्यं च समचित्तत्वमिष्टानिष्टोपपत्तिषु,श्रीभगवानुवाच,13,10,asaktiranabhiShva~NgaH putradAragRRihAdiShu,nityaM cha samachittatvamiShTAniShTopapattiShu,asaktiranaBizvaNgaH putradAragfhAdizu,nityaM ca samacittatvamizwAnizwopapattizu
 १३,११,मयि चानन्ययोगेन भक्तिरव्यभिचारिणी,विविक्तदेशसेवित्वमरतिर्जनसंसदि,श्रीभगवानुवाच,13,11,mayi chAnanyayogena bhaktiravyabhichAriNI,viviktadeshasevitvamaratirjanasaMsadi,mayi cAnanyayogena BaktiravyaBicAriRI,viviktadeSasevitvamaratirjanasaMsadi
 १३,१२,अध्यात्मज्ञाननित्यत्वं तत्त्वज्ञानार्थदर्शनम्,एतज्ज्ञानमिति प्रोक्तमज्ञानं यदतोऽन्यथा,श्रीभगवानुवाच,13,12,adhyAtmaj~nAnanityatvaM tattvaj~nAnArthadarshanam,etajj~nAnamiti proktamaj~nAnaM yadato.anyathA,aDyAtmajYAnanityatvaM tattvajYAnArTadarSanam,etajjYAnamiti proktamajYAnaM yadato'nyaTA
 १३,१३,ज्ञेयं यत्तत्प्रवक्ष्यामि यज्ज्ञात्वामृतमश्नुते,अनादिमत्परं ब्रह्म न सत्तन्नासदुच्यते,श्रीभगवानुवाच,13,13,j~neyaM yattatpravakShyAmi yajj~nAtvAmRRitamashnute,anAdimatparaM brahma na sattannAsaduchyate,jYeyaM yattatpravakzyAmi yajjYAtvAmftamaSnute,anAdimatparaM brahma na sattannAsaducyate
 १३,१४,सर्वतः पाणिपादं तत्सर्वतोऽक्षिशिरोमुखम्,सर्वतः श्रुतिमल्लोके सर्वमावृत्य तिष्ठति,श्रीभगवानुवाच,13,14,sarvataH pANipAdaM tatsarvato.akShishiromukham,sarvataH shrutimalloke sarvamAvRRitya tiShThati,sarvataH pARipAdaM tatsarvato'kziSiromuKam,sarvataH Srutimalloke sarvamAvftya tizWati
 १३,१५,सर्वेन्द्रियगुणाभासं सर्वेन्द्रियविवर्जितम्,असक्तं सर्वभृच्चैव निर्गुणं गुणभोक्तृ च,श्रीभगवानुवाच,13,15,sarvendriyaguNAbhAsaM sarvendriyavivarjitam,asaktaM sarvabhRRichchaiva nirguNaM guNabhoktRRi cha,sarvendriyaguRABAsaM sarvendriyavivarjitam,asaktaM sarvaBfccEva nirguRaM guRaBoktf ca
 १३,१६,बहिरन्तश्च भूतानामचरं चरमेव च,सूक्ष्मत्वात्तदविज्ञेयं दूरस्थं चान्तिके च तत्,श्रीभगवानुवाच,13,16,bahirantashcha bhUtAnAmacharaM charameva cha,sUkShmatvAttadavij~neyaM dUrasthaM chAntike cha tat,bahirantaSca BUtAnAmacaraM carameva ca,sUkzmatvAttadavijYeyaM dUrasTaM cAntike ca tat
 १३,१७,अविभक्तं च भूतेषु विभक्तमिव च स्थितम्,भूतभर्तृ च तज्ज्ञेयं ग्रसिष्णु प्रभविष्णु च,श्रीभगवानुवाच,13,17,avibhaktaM cha bhUteShu vibhaktamiva cha sthitam,bhUtabhartRRi cha tajj~neyaM grasiShNu prabhaviShNu cha,aviBaktaM ca BUtezu viBaktamiva ca sTitam,BUtaBartf ca tajjYeyaM grasizRu praBavizRu ca
 १३,१८,ज्योतिषामपि तज्ज्योतिस्तमसः परमुच्यते,ज्ञानं ज्ञेयं ज्ञानगम्यं हृदि सर्वस्य विष्ठितम्,श्रीभगवानुवाच,13,18,jyotiShAmapi tajjyotistamasaH paramuchyate,j~nAnaM j~neyaM j~nAnagamyaM hRRidi sarvasya viShThitam,jyotizAmapi tajjyotistamasaH paramucyate,jYAnaM jYeyaM jYAnagamyaM hfdi sarvasya vizWitam
 १३,१९,इति क्षेत्रं तथा ज्ञानं ज्ञेयं चोक्तं समासतः,मद्भक्त एतद्विज्ञाय मद्भावायोपपद्यते,श्रीभगवानुवाच,13,19,iti kShetraM tathA j~nAnaM j~neyaM choktaM samAsataH,madbhakta etadvij~nAya madbhAvAyopapadyate,iti kzetraM taTA jYAnaM jYeyaM coktaM samAsataH,madBakta etadvijYAya madBAvAyopapadyate
 १३,२०,प्रकृतिं पुरुषं चैव विद्ध्यनादी उभावपि,विकारांश्च गुणांश्चैव विद्धि प्रकृतिसम्भवान्,श्रीभगवानुवाच,13,20,prakRRitiM puruShaM chaiva viddhyanAdI ubhAvapi,vikArAMshcha guNAMshchaiva viddhi prakRRitisambhavAn,prakftiM puruzaM cEva vidDyanAdI uBAvapi,vikArAMSca guRAMScEva vidDi prakftisamBavAn
 १३,२१,कार्यकारणकर्तृत्वे हेतुः प्रकृतिरुच्यते,पुरुषः सुखदुःखानां भोक्तृत्वे हेतुरुच्यते,श्रीभगवानुवाच,13,21,kAryakAraNakartRRitve hetuH prakRRitiruchyate,puruShaH sukhaduHkhAnAM bhoktRRitve heturuchyate,kAryakAraRakartftve hetuH prakftirucyate,puruzaH suKaduHKAnAM Boktftve heturucyate
 १३,२२,पुरुषः प्रकृतिस्थो हि भुङ्क्ते प्रकृतिजान्गुणान्,कारणं गुणसङ्गोऽस्य सदसद्योनिजन्मसु,श्रीभगवानुवाच,13,22,puruShaH prakRRitistho hi bhu~Nkte prakRRitijAnguNAn,kAraNaM guNasa~Ngo.asya sadasadyonijanmasu,puruzaH prakftisTo hi BuNkte prakftijAnguRAn,kAraRaM guRasaNgo'sya sadasadyonijanmasu
 १३,२३,उपद्रष्टानुमन्ता च भर्ता भोक्ता महेश्वरः,परमात्मेति चाप्युक्तो देहेऽस्मिन्पुरुषः परः,श्रीभगवानुवाच,13,23,upadraShTAnumantA cha bhartA bhoktA maheshvaraH,paramAtmeti chApyukto dehe.asminpuruShaH paraH,upadrazwAnumantA ca BartA BoktA maheSvaraH,paramAtmeti cApyukto dehe'sminpuruzaH paraH
 १३,२४,य एवं वेत्ति पुरुषं प्रकृतिं च गुणैः सह,सर्वथा वर्तमानोऽपि न स भूयोऽभिजायते,श्रीभगवानुवाच,13,24,ya evaM vetti puruShaM prakRRitiM cha guNaiH saha,sarvathA vartamAno.api na sa bhUyo.abhijAyate,ya evaM vetti puruzaM prakftiM ca guREH saha,sarvaTA vartamAno'pi na sa BUyo'BijAyate
 १३,२५,ध्यानेनात्मनि पश्यन्ति केचिदात्मानमात्मना,अन्ये साङ्ख्येन योगेन कर्मयोगेन चापरे,श्रीभगवानुवाच,13,25,dhyAnenAtmani pashyanti kechidAtmAnamAtmanA,anye sA~Nkhyena yogena karmayogena chApare,DyAnenAtmani paSyanti kecidAtmAnamAtmanA,anye sANKyena yogena karmayogena cApare
 १३,२६,अन्ये त्वेवमजानन्तः श्रुत्वान्येभ्य उपासते,तेऽपि चातितरन्त्येव मृत्युं श्रुतिपरायणाः,श्रीभगवानुवाच,13,26,anye tvevamajAnantaH shrutvAnyebhya upAsate,te.api chAtitarantyeva mRRityuM shrutiparAyaNAH,anye tvevamajAnantaH SrutvAnyeBya upAsate,te'pi cAtitarantyeva mftyuM SrutiparAyaRAH
 १३,२७,यावत्सञ्जायते किञ्चित्सत्त्वं स्थावरजङ्गमम्,क्षेत्रक्षेत्रज्ञसंयोगात्तद्विद्धि भरतर्षभ,श्रीभगवानुवाच,13,27,yAvatsa~njAyate ki~nchitsattvaM sthAvaraja~Ngamam,kShetrakShetraj~nasaMyogAttadviddhi bharatarShabha,yAvatsaYjAyate kiYcitsattvaM sTAvarajaNgamam,kzetrakzetrajYasaMyogAttadvidDi BaratarzaBa
 १३,२८,समं सर्वेषु भूतेषु तिष्ठन्तं परमेश्वरम्,विनश्यत्स्वविनश्यन्तं यः पश्यति स पश्यति,श्रीभगवानुवाच,13,28,samaM sarveShu bhUteShu tiShThantaM parameshvaram,vinashyatsvavinashyantaM yaH pashyati sa pashyati,samaM sarvezu BUtezu tizWantaM parameSvaram,vinaSyatsvavinaSyantaM yaH paSyati sa paSyati
 १३,२९,समं पश्यन्हि सर्वत्र समवस्थितमीश्वरम्,न हिनस्त्यात्मनात्मानं ततो याति परां गतिम्,श्रीभगवानुवाच,13,29,samaM pashyanhi sarvatra samavasthitamIshvaram,na hinastyAtmanAtmAnaM tato yAti parAM gatim,samaM paSyanhi sarvatra samavasTitamISvaram,na hinastyAtmanAtmAnaM tato yAti parAM gatim
 १३,३०,प्रकृत्यैव च कर्माणि क्रियमाणानि सर्वशः,यः पश्यति तथात्मानमकर्तारं स पश्यति,श्रीभगवानुवाच,13,30,prakRRityaiva cha karmANi kriyamANAni sarvashaH,yaH pashyati tathAtmAnamakartAraM sa pashyati,prakftyEva ca karmARi kriyamARAni sarvaSaH,yaH paSyati taTAtmAnamakartAraM sa paSyati
 १३,३१,यदा भूतपृथग्भावमेकस्थमनुपश्यति,तत एव च विस्तारं ब्रह्म सम्पद्यते तदा,श्रीभगवानुवाच,13,31,yadA bhUtapRRithagbhAvamekasthamanupashyati,tata eva cha vistAraM brahma sampadyate tadA,yadA BUtapfTagBAvamekasTamanupaSyati,tata eva ca vistAraM brahma sampadyate tadA
 १३,३२,अनादित्वान्निर्गुणत्वात्परमात्मायमव्ययः,शरीरस्थोऽपि कौन्तेय न करोति न लिप्यते,श्रीभगवानुवाच,13,32,anAditvAnnirguNatvAtparamAtmAyamavyayaH,sharIrastho.api kaunteya na karoti na lipyate,anAditvAnnirguRatvAtparamAtmAyamavyayaH,SarIrasTo'pi kOnteya na karoti na lipyate
 १३,३३,यथा सर्वगतं सौक्ष्म्यादाकाशं नोपलिप्यते,सर्वत्रावस्थितो देहे तथात्मा नोपलिप्यते,श्रीभगवानुवाच,13,33,yathA sarvagataM saukShmyAdAkAshaM nopalipyate,sarvatrAvasthito dehe tathAtmA nopalipyate,yaTA sarvagataM sOkzmyAdAkASaM nopalipyate,sarvatrAvasTito dehe taTAtmA nopalipyate
 १३,३४,यथा प्रकाशयत्येकः कृत्स्नं लोकमिमं रविः,क्षेत्रं क्षेत्री तथा कृत्स्नं प्रकाशयति भारत,श्रीभगवानुवाच,13,34,yathA prakAshayatyekaH kRRitsnaM lokamimaM raviH,kShetraM kShetrI tathA kRRitsnaM prakAshayati bhArata,yaTA prakASayatyekaH kftsnaM lokamimaM raviH,kzetraM kzetrI taTA kftsnaM prakASayati BArata
 १३,३५,क्षेत्रक्षेत्रज्ञयोरेवमन्तरं ज्ञानचक्षुषा,भूतप्रकृतिमोक्षं च ये विदुर्यान्ति ते परम्,श्रीभगवानुवाच,13,35,kShetrakShetraj~nayorevamantaraM j~nAnachakShuShA,bhUtaprakRRitimokShaM cha ye viduryAnti te param,kzetrakzetrajYayorevamantaraM jYAnacakzuzA,BUtaprakftimokzaM ca ye viduryAnti te param
 १४,१,परं भूयः प्रवक्ष्यामि ज्ञानानां ज्ञानमुत्तमम्,यज्ज्ञात्वा मुनयः सर्वे परां सिद्धिमितो गताः,श्रीभगवानुवाच,14,1,paraM bhUyaH pravakShyAmi j~nAnAnAM j~nAnamuttamam,yajj~nAtvA munayaH sarve parAM siddhimito gatAH,paraM BUyaH pravakzyAmi jYAnAnAM jYAnamuttamam,yajjYAtvA munayaH sarve parAM sidDimito gatAH
 १४,२,इदं ज्ञानमुपाश्रित्य मम साधर्म्यमागताः,सर्गेऽपि नोपजायन्ते प्रलये न व्यथन्ति च,श्रीभगवानुवाच,14,2,idaM j~nAnamupAshritya mama sAdharmyamAgatAH,sarge.api nopajAyante pralaye na vyathanti cha,idaM jYAnamupASritya mama sADarmyamAgatAH,sarge'pi nopajAyante pralaye na vyaTanti ca
 १४,३,मम योनिर्महद् ब्रह्म तस्मिन्गर्भं दधाम्यहम्,सम्भवः सर्वभूतानां ततो भवति भारत,श्रीभगवानुवाच,14,3,mama yonirmahad brahma tasmingarbhaM dadhAmyaham,sambhavaH sarvabhUtAnAM tato bhavati bhArata,mama yonirmahad brahma tasmingarBaM daDAmyaham,samBavaH sarvaBUtAnAM tato Bavati BArata
 १४,४,सर्वयोनिषु कौन्तेय मूर्तयः सम्भवन्ति याः,तासां ब्रह्म महद्योनिरहं बीजप्रदः पिता,श्रीभगवानुवाच,14,4,sarvayoniShu kaunteya mUrtayaH sambhavanti yAH,tAsAM brahma mahadyonirahaM bIjapradaH pitA,sarvayonizu kOnteya mUrtayaH samBavanti yAH,tAsAM brahma mahadyonirahaM bIjapradaH pitA
 १४,५,सत्त्वं रजस्तम इति गुणाः प्रकृतिसम्भवाः,निबध्नन्ति महाबाहो देहे देहिनमव्ययम्,श्रीभगवानुवाच,14,5,sattvaM rajastama iti guNAH prakRRitisambhavAH,nibadhnanti mahAbAho dehe dehinamavyayam,sattvaM rajastama iti guRAH prakftisamBavAH,nibaDnanti mahAbAho dehe dehinamavyayam
 १४,६,तत्र सत्त्वं निर्मलत्वात्प्रकाशकमनामयम्,सुखसङ्गेन बध्नाति ज्ञानसङ्गेन चानघ,श्रीभगवानुवाच,14,6,tatra sattvaM nirmalatvAtprakAshakamanAmayam,sukhasa~Ngena badhnAti j~nAnasa~Ngena chAnagha,tatra sattvaM nirmalatvAtprakASakamanAmayam,suKasaNgena baDnAti jYAnasaNgena cAnaGa
 १४,७,रजो रागात्मकं विद्धि तृष्णासङ्गसमुद्भवम्,तन्निबध्नाति कौन्तेय कर्मसङ्गेन देहिनम्,श्रीभगवानुवाच,14,7,rajo rAgAtmakaM viddhi tRRiShNAsa~Ngasamudbhavam,tannibadhnAti kaunteya karmasa~Ngena dehinam,rajo rAgAtmakaM vidDi tfzRAsaNgasamudBavam,tannibaDnAti kOnteya karmasaNgena dehinam
 १४,८,तमस्त्वज्ञानजं विद्धि मोहनं सर्वदेहिनाम्,प्रमादालस्यनिद्राभिस्तन्निबध्नाति भारत,श्रीभगवानुवाच,14,8,tamastvaj~nAnajaM viddhi mohanaM sarvadehinAm,pramAdAlasyanidrAbhistannibadhnAti bhArata,tamastvajYAnajaM vidDi mohanaM sarvadehinAm,pramAdAlasyanidrABistannibaDnAti BArata
 १४,९,सत्त्वं सुखे सञ्जयति रजः कर्मणि भारत,ज्ञानमावृत्य तु तमः प्रमादे सञ्जयत्युत,श्रीभगवानुवाच,14,9,sattvaM sukhe sa~njayati rajaH karmaNi bhArata,j~nAnamAvRRitya tu tamaH pramAde sa~njayatyuta,sattvaM suKe saYjayati rajaH karmaRi BArata,jYAnamAvftya tu tamaH pramAde saYjayatyuta
 १४,१०,रजस्तमश्चाभिभूय सत्त्वं भवति भारत,रजः सत्त्वं तमश्चैव तमः सत्त्वं रजस्तथा,श्रीभगवानुवाच,14,10,rajastamashchAbhibhUya sattvaM bhavati bhArata,rajaH sattvaM tamashchaiva tamaH sattvaM rajastathA,rajastamaScABiBUya sattvaM Bavati BArata,rajaH sattvaM tamaScEva tamaH sattvaM rajastaTA
 १४,११,सर्वद्वारेषु देहेऽस्मिन्प्रकाश उपजायते,ज्ञानं यदा तदा विद्याद्विवृद्धं सत्त्वमित्युत,श्रीभगवानुवाच,14,11,sarvadvAreShu dehe.asminprakAsha upajAyate,j~nAnaM yadA tadA vidyAdvivRRiddhaM sattvamityuta,sarvadvArezu dehe'sminprakASa upajAyate,jYAnaM yadA tadA vidyAdvivfdDaM sattvamityuta
 १४,१२,लोभः प्रवृत्तिरारम्भः कर्मणामशमः स्पृहा,रजस्येतानि जायन्ते विवृद्धे भरतर्षभ,श्रीभगवानुवाच,14,12,lobhaH pravRRittirArambhaH karmaNAmashamaH spRRihA,rajasyetAni jAyante vivRRiddhe bharatarShabha,loBaH pravfttirAramBaH karmaRAmaSamaH spfhA,rajasyetAni jAyante vivfdDe BaratarzaBa
 १४,१३,अप्रकाशोऽप्रवृत्तिश्च प्रमादो मोह एव च,तमस्येतानि जायन्ते विवृद्धे कुरुनन्दन,श्रीभगवानुवाच,14,13,aprakAsho.apravRRittishcha pramAdo moha eva cha,tamasyetAni jAyante vivRRiddhe kurunandana,aprakASo'pravfttiSca pramAdo moha eva ca,tamasyetAni jAyante vivfdDe kurunandana
 १४,१४,यदा सत्त्वे प्रवृद्धे तु प्रलयं याति देहभृत्,तदोत्तमविदां लोकानमलान्प्रतिपद्यते,श्रीभगवानुवाच,14,14,yadA sattve pravRRiddhe tu pralayaM yAti dehabhRRit,tadottamavidAM lokAnamalAnpratipadyate,yadA sattve pravfdDe tu pralayaM yAti dehaBft,tadottamavidAM lokAnamalAnpratipadyate
 १४,१५,रजसि प्रलयं गत्वा कर्मसङ्गिषु जायते,तथा प्रलीनस्तमसि मूढयोनिषु जायते,श्रीभगवानुवाच,14,15,rajasi pralayaM gatvA karmasa~NgiShu jAyate,tathA pralInastamasi mUDhayoniShu jAyate,rajasi pralayaM gatvA karmasaNgizu jAyate,taTA pralInastamasi mUQayonizu jAyate
 १४,१६,कर्मणः सुकृतस्याहुः सात्त्विकं निर्मलं फलम्,रजसस्तु फलं दुःखमज्ञानं तमसः फलम्,श्रीभगवानुवाच,14,16,karmaNaH sukRRitasyAhuH sAttvikaM nirmalaM phalam,rajasastu phalaM duHkhamaj~nAnaM tamasaH phalam,karmaRaH sukftasyAhuH sAttvikaM nirmalaM Palam,rajasastu PalaM duHKamajYAnaM tamasaH Palam
 १४,१७,सत्त्वात्सञ्जायते ज्ञानं रजसो लोभ एव च,प्रमादमोहौ तमसो भवतोऽज्ञानमेव च,श्रीभगवानुवाच,14,17,sattvAtsa~njAyate j~nAnaM rajaso lobha eva cha,pramAdamohau tamaso bhavato.aj~nAnameva cha,sattvAtsaYjAyate jYAnaM rajaso loBa eva ca,pramAdamohO tamaso Bavato'jYAnameva ca
